gen,idx,p_human,p_human_pct,len_chars,preview
7,3,0.8562962179763751,85.62962179763751,613,"A bird hit the glass door. Mid-day heatwave. I remember finding it twitching still. Its chest heaving in this frantic, uneven way... made my stomach hurt. I knelt on the stones; th..."
7,1,0.84363625403637,84.363625403637,623,"Mid-day heatwave. A bird hit the glass door. I remember finding it there... twitching still. Its chest heaving, frantic and uneven. Made my stomach hurt. I knelt on the patio stone..."
7,6,0.8401653714579623,84.01653714579624,614,"Mid-day heatwave. A bird hit the glass door. I remember finding it there, still twitching. Chest heaving... frantic and uneven. It made my stomach turn. I knelt on the patio stones..."
7,4,0.8386561028462204,83.86561028462204,579,"Mid-day heatwave. Bird hit the glass door. I remember finding it twitching. Chest heaving, frantic and uneven... making my stomach turn. I knelt on the stones. They were burning. M..."
7,2,0.8359011382348118,83.59011382348118,618,"A bird hit the glass door. Mid-day heatwave. I remember finding it there, twitching still. Chest heaving, frantic and uneven... making my stomach turn. I knelt on the patio stones...."
7,5,0.8266205460322376,82.66205460322375,611,"It was a mid-day heatwave. A bird hit the glass door. I remember finding it there... twitching still. Chest heaving, frantic and uneven. It made my stomach hurt. I knelt on the pat..."
